<?xml version="1.0" encoding="UTF-8"?>
<!-- play group:0, enemyGroup :1 -->
<root
    xmlns:xsi='http://www.w3.org/2001/XMLSchema-instance'
    xmlns='http://luoying.huliqing.name'
    xsi:schemaLocation='http://luoying.huliqing.name meta/bullet.xsd'>
    
    <!--=====================================================================-->
    <!--基本配置-->
    <!--=====================================================================-->

    <!--所有子弹的统一配置-->
    <bulletBase id="bulletBase" shape="shapeBulletBox" shapeOffset="0,0,-1.9" baseSpeed="30" timeout="6" 
                debug="0" queueBucket="Translucent" />
    
    <!-- 子弹基本配置-->    
    <bulletStraight id="bulletStraightBase" extends="bulletBase" facing="1" />
    
    <!--快速直线型子弹:不跟随-->
    <bulletStraight id="bulletQuickBase" extends="bulletBase" facing="1" shape="shapeBulletBoxMax" shapeOffset="0,0,-2.9" />
    
    <!--曲线拖尾:不跟随（暂时对跟随效果不友好），但是加大shape -->
    <bulletCurveTrail id="bulletTrailBase" extends="bulletBase" facing="1" shape="shapeBulletBoxMax" shapeOffset="0,0,-2.9"
                      texScale="0.3" width="0.15" tex="Textures/effect/light.jpg" mask="Textures/effect/lightMask.jpg" tension="0.5" />
    
    <!--=====================================================================-->
    <!--通用形子弹-->
    <!--=====================================================================-->
    
    <!-- 默认子弹：直中,无路线 -->
    <bulletSimple id="bulletDefault" extends="bulletBase" />
    
    <!--普通箭-->
    <bulletStraight id="bulletArrow" extends="bulletStraightBase" trace="1" effects="effectBulletArrow" hitSounds="soundBowHit" />

    <!--火弹-->
    <bulletStraight id="bulletTowerFire" extends="bulletStraightBase" trace="1" effects="effectSmokeFire" hitEffects="effectExplosion" />
    
    <!--石弹-->
    <bulletStraight id="bulletTowerStone" extends="bulletStraightBase" trace="0" effects="effectTowerStone" hitEffects="effectExplosion" />
    
    <!--雪弹-->
    <bulletStraight id="bulletSnow" extends="bulletStraightBase" trace="1" effects="effectSnowBullet" hitEffects="effectSnowExplosion" />
    
    <!--增益: 加血，加魔，加状态，会跟随，保证不失手-->
    <bulletCurve id="bulletBuff" extends="bulletStraightBase" shape="shapeBulletBoxMin" shapeOffset="0,0,0" trace="1" effects="effectBuffBullet" hitEffects="effectBuffHit" positions="positionShapeBuff"/>
    
    <!--=====================================================================-->
    <!--特殊技能子弹-->
    <!--=====================================================================-->
    
<!--    闪电箭: 直线型 
    <bulletStraight id="bulletArrowQuick" extends="bulletQuickBase" effects="effectLightningShotBullet" 
                    hitEffects="effectLightningShotHit" hitSounds="soundBowHit" />
    
     落樱飞舞：曲线拖尾 
     <bulletCurveTrail id="bulletCurve" extends="bulletTrailBase"  effects="effectDanceSakuraBullet"
                       hitEffects="effectDanceSakuraHit" positions="positionDanceSakuraWaypoint,positionDanceSakuraWaypoint2" />
    
     电光火石
     <bulletCurve id="bulletFlowLight" extends="bulletStraightBase" trace="1" effects="effectFlowLight" 
                  hitEffects="effectFlowLightHit" positions="positionFlowLight"/>
     
     寒冰箭：拖尾形子弹三连发
     <bulletCurveTrail id="bulletIceTrailUp" extends="bulletTrailBase" effects="effectIceBullet" positions="positionDefShotUp" />
     <bulletCurveTrail id="bulletIceTrailLeft" extends="bulletIceTrailUp" positions="positionDefShotLeft" />
     <bulletCurveTrail id="bulletIceTrailRight" extends="bulletIceTrailUp" positions="positionDefShotRight"  />-->

</root>
